{
  "ok": true,
  "bundleId": "dbg_20260304_2035",
  "generatedAt": "2026-03-04T20:35:00Z",
  "artifacts": {
    "snapshot": "/tmp/debug/snapshot.json",
    "screenshot": "/tmp/debug/screenshot.png",
    "console": "/tmp/debug/console.json",
    "network": "/tmp/debug/network.json",
    "errors": "/tmp/debug/errors.json"
  },
  "summary": {
    "consoleCount": 14,
    "networkCount": 62,
    "errorCount": 2
  }
}
